{
  "$schema": "https://json-schema.org/draft/2020-12/schema",
  "title": "Generated Schema",
  "type": "object",
  "properties": {
    "id": {
      "type": "integer"
    },
    "title": {
      "type": "string"
    },
    "price": {
      "type": "number"
    },
    "description": {
      "type": "string"
    },
    "category": {
      "type": "string"
    },
    "image": {
      "type": "string",
      "format": "uri"
    },
    "rating": {
      "type": "object",
      "properties": {
        "rate": {
          "type": "number"
        },
        "count": {
          "type": "integer"
        }
      },
      "required": [
        "rate",
        "count"
      ]
    }
  },
  "required": [
    "id",
    "title",
    "price",
    "description",
    "category",
    "image",
    "rating"
  ]
}